{
  "shot_id": "shot_001",
  "render_route": "voice_bound_shot_video",
  "status": "success",
  "input": {
    "first_frame": "shots/shot_001/input/first_frame.png",
    "voice_audio": "shots/shot_001/input/voice_clean.wav",
    "dialogue_text": "你终于回来了。",
    "motion_tag": "male_talk_neutral",
    "motion_prompt_cn": "男人在说话",
    "width": 736,
    "height": 1280
  },
  "output": {
    "video": "shots/shot_001/outputs/shot_001_voice_bound.mp4",
    "response_json": "shots/shot_001/outputs/response.json"
  },
  "runtime": {
    "provider": "runninghub",
    "workflow_type": "voice_bound_video_app",
    "app_url": "https://www.runninghub.cn/ai-detail/2036019863617015809",
    "task_id": "2036019863617015809"
  }
}
